{
  "version": "0.1",
  "trace": "trace-burn-001",
  "status": "burn",
  "deployment_profile_id": "nixos-host-main",
  "mode": "burn",
  "selected_backend_provider_id": "vault-dynamic-main",
  "selected_materializer_provider_id": "systemd-cred-main",
  "attestation_id": "att-2026-04-13T14:30:00Z-host-1",
  "revocation_snapshot_id": "rev-2026-04-13T14:30:00Z",
  "audit_required": true,
  "audit_sink_id": "audit-main",
  "reasons": [
    "burn mode active"
  ],
  "provider_facts": {
    "mode_epoch": 6,
    "controller_id": "mode-main"
  }
}
