{
  "version": "0.1",
  "trace": "trace-allow-001",
  "status": "deny",
  "deployment_profile_id": "nixos-host-main",
  "mode": "normal",
  "selected_backend_provider_id": "vault-dynamic-main",
  "selected_materializer_provider_id": "systemd-cred-main",
  "attestation_id": "att-2026-04-13T14:30:00Z-host-2",
  "revocation_snapshot_id": "rev-2026-04-13T14:30:00Z",
  "audit_required": true,
  "audit_sink_id": "audit-main",
  "reasons": [
    "attestation not verified",
    "posture digest mismatch"
  ],
  "provider_facts": {
    "mode_epoch": 5,
    "controller_id": "mode-main",
    "attestation_status": "failed",
    "revocation_snapshot_fresh_until": "2026-04-13T14:31:00Z"
  }
}
