{
  "version": "0.1",
  "trace": "trace-allow-001",
  "status": "accept",
  "deployment_profile_id": "nixos-host-main",
  "mode": "normal",
  "selected_backend_provider_id": "vault-dynamic-main",
  "selected_materializer_provider_id": "systemd-cred-main",
  "attestation_id": "att-2026-04-13T14:30:00Z-host-1",
  "revocation_snapshot_id": "rev-2026-04-13T14:30:00Z",
  "audit_required": true,
  "audit_sink_id": "audit-main",
  "session_expires_at": "2026-04-13T14:35:30Z",
  "reasons": [],
  "provider_facts": {
    "mode_epoch": 5,
    "controller_id": "mode-main",
    "binding_secret_class": "database-credential",
    "requested_method": "systemd-credential"
  }
}
